{"collection_key":"gate-creek","durable_base_uri":"https://firewisewatersheds.org/artifacts/v1/production/","geometries":[{"artifact":{"bytes":408908,"media_type":"application/geo+json","sha256":"0d3e20651042bda296897e48be22cbb99aec4684e6066eeba570718b8f78e504","uri":"https://firewisewatersheds.org/artifacts/v1/production/objects/sha256/0d/0d3e20651042bda296897e48be22cbb99aec4684e6066eeba570718b8f78e504","verified":true},"feature_count":173,"required_for_activation":true,"scale":"hillslope","scenarios":["S1","S2","S4b"],"source_crs":"EPSG:26910"},{"artifact":{"bytes":12130352,"media_type":"application/geo+json","sha256":"7b4c86bd6b57c389eee8c2a03c35dc1a200a35b6b6808072fa67a33a2647f3b8","uri":"https://firewisewatersheds.org/artifacts/v1/production/objects/sha256/7b/7b4c86bd6b57c389eee8c2a03c35dc1a200a35b6b6808072fa67a33a2647f3b8","verified":true},"feature_count":44203,"required_for_activation":true,"scale":"patch","scenarios":["S1","S4b"],"source_crs":"EPSG:26910"},{"artifact":{"bytes":4298597,"media_type":"application/geo+json","sha256":"6a77938a0364e13c5c8d0683b9f53ce3d2da30f72420ba752d35ad71b0a6c16b","uri":"https://firewisewatersheds.org/artifacts/v1/production/objects/sha256/6a/6a77938a0364e13c5c8d0683b9f53ce3d2da30f72420ba752d35ad71b0a6c16b","verified":true},"feature_count":12132,"required_for_activation":true,"scale":"patch","scenarios":["S2"],"source_crs":"EPSG:26910"}],"geometry_revision":"639b41fb64d235830fe32e1eadda1d19669b7488c49dfe9f44e588884a805d56","geotiffs":[],"mode":"dynamic","parquets":[{"artifact":{"bytes":8594298,"media_type":"application/vnd.apache.parquet","sha256":"c8f207b1b89bb327fe18c72fc715a3c5737cb301ab8136f6e0dabb9750bce7a6","uri":"https://firewisewatersheds.org/artifacts/v1/production/objects/sha256/c8/c8f207b1b89bb327fe18c72fc715a3c5737cb301ab8136f6e0dabb9750bce7a6","verified":true},"columns":[{"name":"day","physical_type":"INT64"},{"name":"month","physical_type":"INT64"},{"name":"year","physical_type":"INT64"},{"name":"basinID","physical_type":"INT64"},{"name":"pot_surface_infil","physical_type":"DOUBLE"},{"name":"snow_thr","physical_type":"DOUBLE"},{"name":"sat_def_z","physical_type":"DOUBLE"},{"name":"sat_def","physical_type":"DOUBLE"},{"name":"rz_storage","physical_type":"DOUBLE"},{"name":"unsat_stor","physical_type":"DOUBLE"},{"name":"rz_drainage","physical_type":"DOUBLE"},{"name":"unsat_drain","physical_type":"DOUBLE"},{"name":"cap","physical_type":"DOUBLE"},{"name":"evap","physical_type":"DOUBLE"},{"name":"snowpack","physical_type":"DOUBLE"},{"name":"trans","physical_type":"DOUBLE"},{"name":"baseflow","physical_type":"DOUBLE"},{"name":"return","physical_type":"DOUBLE"},{"name":"streamflow","physical_type":"DOUBLE"},{"name":"psn","physical_type":"DOUBLE"},{"name":"nppcum","physical_type":"DOUBLE"},{"name":"lai","physical_type":"DOUBLE"},{"name":"gw.Qout","physical_type":"DOUBLE"},{"name":"gw.storage","physical_type":"DOUBLE"},{"name":"detention_store","physical_type":"DOUBLE"},{"name":"%sat_area","physical_type":"DOUBLE"},{"name":"litter_store","physical_type":"DOUBLE"},{"name":"canopy_store","physical_type":"DOUBLE"},{"name":"%snow_cover","physical_type":"DOUBLE"},{"name":"snow_subl","physical_type":"DOUBLE"},{"name":"trans_var","physical_type":"DOUBLE"},{"name":"acc_trans","physical_type":"DOUBLE"},{"name":"acctransv_var","physical_type":"DOUBLE"},{"name":"tpet","physical_type":"DOUBLE"},{"name":"pet","physical_type":"DOUBLE"},{"name":"pe","physical_type":"DOUBLE"},{"name":"dC13","physical_type":"DOUBLE"},{"name":"precip","physical_type":"DOUBLE"},{"name":"pcp_assim","physical_type":"DOUBLE"},{"name":"mortf","physical_type":"DOUBLE"},{"name":"tmax","physical_type":"DOUBLE"},{"name":"tmin","physical_type":"DOUBLE"},{"name":"tavg","physical_type":"DOUBLE"},{"name":"vpd","physical_type":"DOUBLE"},{"name":"snowfall","physical_type":"DOUBLE"},{"name":"recharge","physical_type":"DOUBLE"},{"name":"gpsn","physical_type":"DOUBLE"},{"name":"resp","physical_type":"DOUBLE"},{"name":"gs","physical_type":"DOUBLE"},{"name":"rootdepth","physical_type":"DOUBLE"},{"name":"plantc","physical_type":"DOUBLE"},{"name":"snowmelt","physical_type":"DOUBLE"},{"name":"canopysubl","physical_type":"DOUBLE"},{"name":"routedstreamflow","physical_type":"DOUBLE"},{"name":"canopy_snow","physical_type":"DOUBLE"},{"name":"height","physical_type":"DOUBLE"},{"name":"evap_can","physical_type":"DOUBLE"},{"name":"evap_lit","physical_type":"DOUBLE"},{"name":"evap_soil","physical_type":"DOUBLE"},{"name":"litrc","physical_type":"DOUBLE"},{"name":"Kdown","physical_type":"DOUBLE"},{"name":"Ldown","physical_type":"DOUBLE"},{"name":"Kup","physical_type":"DOUBLE"},{"name":"Lup","physical_type":"DOUBLE"},{"name":"Kstar_can","physical_type":"DOUBLE"},{"name":"Kstar_soil","physical_type":"DOUBLE"},{"name":"Kstar_snow","physical_type":"DOUBLE"},{"name":"Lstar_can","physical_type":"DOUBLE"},{"name":"Lstar_soil","physical_type":"DOUBLE"},{"name":"Lstar_snow","physical_type":"DOUBLE"},{"name":"LE_canopy","physical_type":"DOUBLE"},{"name":"LE_soil","physical_type":"DOUBLE"},{"name":"LE_snow","physical_type":"DOUBLE"},{"name":"Lstar_strat","physical_type":"DOUBLE"},{"name":"canopydrip","physical_type":"DOUBLE"},{"name":"ga","physical_type":"DOUBLE"}],"dataset_key":"s1-basin-daily-parquet","required_for_activation":true,"role":"basin","scenario":"S1","spatial_id_field":"basinID","variables":[{"name":"streamflow","units":"mm/day"},{"name":"baseflow","units":"mm/day"},{"name":"return","units":"mm/day"},{"name":"trans","units":"mm/day"},{"name":"evap","units":"mm/day"}],"year_range":[1985,2024]},{"artifact":{"bytes":6725081,"media_type":"application/vnd.apache.parquet","sha256":"8cda54de2924eb537c9bd0aaaac7fd81968916ba2bde96ce2b6ba80be5997885","uri":"https://firewisewatersheds.org/artifacts/v1/production/objects/sha256/8c/8cda54de2924eb537c9bd0aaaac7fd81968916ba2bde96ce2b6ba80be5997885","verified":true},"columns":[{"name":"day","physical_type":"INT64"},{"name":"month","physical_type":"INT64"},{"name":"year","physical_type":"INT64"},{"name":"basinID","physical_type":"INT64"},{"name":"lai","physical_type":"DOUBLE"},{"name":"lai_b","physical_type":"DOUBLE"},{"name":"pai","physical_type":"DOUBLE"},{"name":"pai_b","physical_type":"DOUBLE"},{"name":"gpsn","physical_type":"DOUBLE"},{"name":"plant_resp","physical_type":"DOUBLE"},{"name":"leaf_resp","physical_type":"DOUBLE"},{"name":"soil_resp","physical_type":"DOUBLE"},{"name":"nitrate","physical_type":"DOUBLE"},{"name":"sminn","physical_type":"DOUBLE"},{"name":"surfaceN","physical_type":"DOUBLE"},{"name":"plantc","physical_type":"DOUBLE"},{"name":"plantn","physical_type":"DOUBLE"},{"name":"cpool","physical_type":"DOUBLE"},{"name":"npool","physical_type":"DOUBLE"},{"name":"litrc","physical_type":"DOUBLE"},{"name":"litrn","physical_type":"DOUBLE"},{"name":"soilc","physical_type":"DOUBLE"},{"name":"soiln","physical_type":"DOUBLE"},{"name":"soiln_noslow","physical_type":"DOUBLE"},{"name":"gwNO3","physical_type":"DOUBLE"},{"name":"gwNH4","physical_type":"DOUBLE"},{"name":"gwDON","physical_type":"DOUBLE"},{"name":"gwDOC","physical_type":"DOUBLE"},{"name":"streamflow_NO3","physical_type":"DOUBLE"},{"name":"streamflow_NH4","physical_type":"DOUBLE"},{"name":"streamflow_DON","physical_type":"DOUBLE"},{"name":"streamflow_DOC","physical_type":"DOUBLE"},{"name":"gwNO3out","physical_type":"DOUBLE"},{"name":"gwNH4out","physical_type":"DOUBLE"},{"name":"gwDONout","physical_type":"DOUBLE"},{"name":"gwDOCout","physical_type":"DOUBLE"},{"name":"denitrif","physical_type":"DOUBLE"},{"name":"nitrif","physical_type":"DOUBLE"},{"name":"DOC","physical_type":"DOUBLE"},{"name":"DON","physical_type":"DOUBLE"},{"name":"root_depth","physical_type":"DOUBLE"},{"name":"nfix","physical_type":"DOUBLE"},{"name":"nuptake","physical_type":"DOUBLE"},{"name":"grazingC","physical_type":"DOUBLE"},{"name":"StreamNO3_from_surface","physical_type":"DOUBLE"},{"name":"StreamNO3_from_sub","physical_type":"DOUBLE"},{"name":"N_dep","physical_type":"DOUBLE"},{"name":"fertilizer_store","physical_type":"DOUBLE"},{"name":"understory_leafc","physical_type":"DOUBLE"},{"name":"understory_stemc","physical_type":"DOUBLE"},{"name":"understory_biomassc","physical_type":"DOUBLE"},{"name":"understory_height","physical_type":"DOUBLE"},{"name":"overstory_leafc","physical_type":"DOUBLE"},{"name":"overstory_stemc","physical_type":"DOUBLE"},{"name":"overstory_biomassc","physical_type":"DOUBLE"},{"name":"overstory_height","physical_type":"DOUBLE"},{"name":"burn","physical_type":"DOUBLE"},{"name":"litterc_burned","physical_type":"DOUBLE"},{"name":"cwdc_to_atoms","physical_type":"DOUBLE"},{"name":"overstory_biomassc_consumed","physical_type":"DOUBLE"},{"name":"overstory_leafc_consumed","physical_type":"DOUBLE"},{"name":"overstory_stemc_consumed","physical_type":"DOUBLE"},{"name":"overstory_biomassc_mortality","physical_type":"DOUBLE"},{"name":"overstory_leafc_mortality","physical_type":"DOUBLE"},{"name":"overstory_stemc_mortality","physical_type":"DOUBLE"},{"name":"understory_biomassc_consumed","physical_type":"DOUBLE"},{"name":"understory_leafc_consumed","physical_type":"DOUBLE"},{"name":"understory_stemc_consumed","physical_type":"DOUBLE"},{"name":"total_snagc","physical_type":"DOUBLE"},{"name":"total_snagn","physical_type":"DOUBLE"},{"name":"total_redneedlec","physical_type":"DOUBLE"},{"name":"total_redneedlen","physical_type":"DOUBLE"},{"name":"deadrootc_beetle","physical_type":"DOUBLE"},{"name":"deadrootn_beetle","physical_type":"DOUBLE"},{"name":"understory_gpsn","physical_type":"DOUBLE"},{"name":"understory_resp","physical_type":"DOUBLE"},{"name":"understory_rootdepth","physical_type":"DOUBLE"},{"name":"understory_npp","physical_type":"DOUBLE"},{"name":"ratio_abg_litter","physical_type":"DOUBLE"},{"name":"litr1_hr","physical_type":"DOUBLE"},{"name":"litr2_hr","physical_type":"DOUBLE"},{"name":"litr3_hr","physical_type":"DOUBLE"},{"name":"litr4_hr","physical_type":"DOUBLE"}],"dataset_key":"s1-grow-basin-daily-parquet","required_for_activation":true,"role"